<?xml version="1.0" encoding="UTF-8"?>
<character xmlns:xsi="http://www.w3.org/2001/XMLSchema-instance"
	xsi:noNamespaceSchemaLocation="../../../../src/games/rolePlayingGames/shadowrun/tracking/trackables/xml/xsd/ShadowrunSchema.xsd">
	<name>Elite Ganger</name>
	<special>0</special>
	<statusEffects>
	</statusEffects>
	<inventory>
		<!-- Knife -->
		<inventoryID>60873b15-34e4-446f-984c-aff16d1c1b09</inventoryID>
		<!-- Rating 2 Commlink -->
		<inventoryID>b3a2b6e5-c5e7-49c7-a006-fe0a77f66d7f</inventoryID>
		<!-- Browning Ultra-Power -->
		<inventoryID>4161e7df-b49f-42b2-8290-cd2e78653dc6</inventoryID>
		<!-- Armor Jacket -->
		<inventoryID>be398a63-797a-47ef-ad93-5d3e05b423bb</inventoryID>
	</inventory>
	<qualities>
		<!-- Toughness -->
		<qualityID>abb5ddc4-12d1-4b5b-a284-e70a1bd61806</qualityID>
	</qualities>
	<body>4</body>
	<willpower>4</willpower>
	<agility>4</agility>
	<reaction>4</reaction>
	<strength>4</strength>
	<logic>3</logic>
	<intuition>4</intuition>
	<charisma>4</charisma>
	<initDice>2</initDice>
	<skills>
		<skill>
			<fullDesc>Blades</fullDesc>
			<level>5</level>
		</skill>
		<skill>
			<fullDesc>Leadership</fullDesc>
			<level>1</level>
		</skill>
		<skill>
			<fullDesc>Intimidation</fullDesc>
			<level>4</level>
		</skill>
		<skill>
			<fullDesc>Pistols</fullDesc>
			<level>5</level>
		</skill>
		<skill>
			<fullDesc>Unarmed Combat</fullDesc>
			<level>5</level>
		</skill>
		<skill>
			<fullDesc>Thrown Weapons</fullDesc>
			<level>2</level>
		</skill>
	</skills>
	<spells>
	</spells>
	<essence>5</essence>
</character>
