<?xml version="1.0" encoding="UTF-8"?>
<meleeWeapon xmlns:xsi="http://www.w3.org/2001/XMLSchema-instance" xsi:noNamespaceSchemaLocation="../../../../src/games/rolePlayingGames/shadowrun/tracking/trackables/xml/xsd/ShadowrunSchema.xsd" xsi:type="meleeWeapon">
  <name>Monofilament Whip</name>
  <id>177f1408-b5ee-45d7-92a6-f5bc31d1346d</id>
  <accuracy>7</accuracy>
  <damageValue>12</damageValue>
  <armorPiercing>-8</armorPiercing>
  <damageElement>REGULAR</damageElement>
  <benefits>none</benefits>
  <reach>2</reach>
</meleeWeapon>
