<?xml version="1.0" encoding="UTF-8"?>
<meleeWeapon xmlns:xsi="http://www.w3.org/2001/XMLSchema-instance" xsi:noNamespaceSchemaLocation="../../../src/games/rolePlayingGames/shadowrun/tracking/trackables/xml/xsd/ShadowrunSchema.xsd" xsi:type="meleeWeapon">
  <name>Pole Arm</name>
  <id>9ef1baaf-76ba-4464-9d8d-5a62e0460ce9</id>
  <accuracy>5</accuracy>
  <damageValue>3</damageValue>
  <armorPiercing>-2</armorPiercing>
  <damageElement>REGULAR</damageElement>
  <benefits>none</benefits>
  <reach>3</reach>
</meleeWeapon>
