<?xml version="1.0" encoding="UTF-8"?>
<meleeWeapon xmlns:xsi="http://www.w3.org/2001/XMLSchema-instance" xsi:noNamespaceSchemaLocation="../../../../src/games/rolePlayingGames/shadowrun/tracking/trackables/xml/xsd/ShadowrunSchema.xsd" xsi:type="meleeWeapon">
  <name>Combat Knife</name>
  <id>ebc85001-5272-43a0-9717-f35a99d36204</id>
  <accuracy>6</accuracy>
  <damageValue>2</damageValue>
  <armorPiercing>-3</armorPiercing>
  <damageElement>REGULAR</damageElement>
  <benefits>none</benefits>
  <reach>0</reach>
</meleeWeapon>
