<?xml version="1.0" encoding="UTF-8"?>
<meleeWeapon xmlns:xsi="http://www.w3.org/2001/XMLSchema-instance" xsi:noNamespaceSchemaLocation="../../../src/games/rolePlayingGames/shadowrun/tracking/trackables/xml/xsd/ShadowrunSchema.xsd" xsi:type="meleeWeapon">
  <name>Extendable Baton</name>
  <id>4d4728e7-5516-475c-af3e-21267e539be0</id>
  <accuracy>5</accuracy>
  <damageValue>2</damageValue>
  <armorPiercing>0</armorPiercing>
  <damageElement>REGULAR</damageElement>
  <benefits>none</benefits>
  <reach>1</reach>
</meleeWeapon>
