<?xml version="1.0" encoding="UTF-8"?>
<meleeWeapon xmlns:xsi="http://www.w3.org/2001/XMLSchema-instance" xsi:noNamespaceSchemaLocation="../../../../src/games/rolePlayingGames/shadowrun/tracking/trackables/xml/xsd/ShadowrunSchema.xsd" xsi:type="meleeWeapon">
  <name>Sap</name>
  <id>154900d3-7de6-4f66-a43b-946ff32671bb</id>
  <accuracy>5</accuracy>
  <damageValue>2</damageValue>
  <armorPiercing>0</armorPiercing>
  <damageElement>REGULAR</damageElement>
  <benefits>none</benefits>
  <reach>0</reach>
</meleeWeapon>
