<?xml version="1.0" encoding="UTF-8"?>
<meleeWeapon xmlns:xsi="http://www.w3.org/2001/XMLSchema-instance" xsi:noNamespaceSchemaLocation="../../../src/games/rolePlayingGames/shadowrun/tracking/trackables/xml/xsd/ShadowrunSchema.xsd" xsi:type="meleeWeapon">
  <name>Telescoping Staff</name>
  <id>614874c0-8ece-4b55-ae68-a35dc5d52eed</id>
  <accuracy>4</accuracy>
  <damageValue>2</damageValue>
  <armorPiercing>0</armorPiercing>
  <damageElement>REGULAR</damageElement>
  <benefits>none</benefits>
  <reach>2</reach>
</meleeWeapon>
