<?xml version="1.0" encoding="UTF-8"?>
<meleeWeapon xmlns:xsi="http://www.w3.org/2001/XMLSchema-instance" xsi:noNamespaceSchemaLocation="../../../../src/games/rolePlayingGames/shadowrun/tracking/trackables/xml/xsd/ShadowrunSchema.xsd" xsi:type="meleeWeapon">
  <name>Forearm Snap Blades</name>
  <id>977020a2-de1a-4587-8344-d19c6c103ea9</id>
  <accuracy>4</accuracy>
  <damageValue>2</damageValue>
  <armorPiercing>-2</armorPiercing>
  <damageElement>REGULAR</damageElement>
  <benefits>none</benefits>
  <reach>0</reach>
</meleeWeapon>
