<?xml version="1.0" encoding="UTF-8"?>
<meleeWeapon xmlns:xsi="http://www.w3.org/2001/XMLSchema-instance" xsi:noNamespaceSchemaLocation="../../../src/games/rolePlayingGames/shadowrun/tracking/trackables/xml/xsd/ShadowrunSchema.xsd" xsi:type="meleeWeapon">
  <name>Staff</name>
  <id>196b3451-f372-4355-8e9b-3f02e48bcad1</id>
  <accuracy>6</accuracy>
  <damageValue>3</damageValue>
  <armorPiercing>0</armorPiercing>
  <damageElement>REGULAR</damageElement>
  <benefits>none</benefits>
  <reach>2</reach>
</meleeWeapon>
