<?xml version="1.0" encoding="UTF-8"?>
<meleeWeapon xmlns:xsi="http://www.w3.org/2001/XMLSchema-instance" xsi:noNamespaceSchemaLocation="../../../src/games/rolePlayingGames/shadowrun/tracking/trackables/xml/xsd/ShadowrunSchema.xsd" xsi:type="meleeWeapon">
  <name>Survival Knife</name>
  <id>405440d1-91a8-4220-82a9-e8dea1b681e4</id>
  <accuracy>5</accuracy>
  <damageValue>2</damageValue>
  <armorPiercing>-1</armorPiercing>
  <damageElement>REGULAR</damageElement>
  <benefits>none</benefits>
  <reach>0</reach>
</meleeWeapon>
